[
  {
    "organisation": "U.S. Soccer (Player Development Initiatives)",
    "country": "United States",
    "age_group": "U6, U7, U8",
    "format": "4v4",
    "players_on_field": 4,
    "match_length_minutes": 40,
    "match_length_basis": "maximum",
    "periods": {
      "count": 4,
      "length_minutes": 10,
      "note": "4 quarters, no more than 10 minutes each; 5 minute breaks between quarters; playing time can be less when managed by coaches and parents"
    },
    "ball_size": 3,
    "goalkeeper": false,
    "heading_rule": "Deliberate heading not allowed in 4v4 games; indirect free kick to opponents from the spot of the offence.",
    "substitution_rule": "Substitutions are unlimited and can occur at any time.",
    "minimum_playing_time_rule": "Philosophy (best practice, not mandated): everyone should participate a minimum of 50% of the time.",
    "build_out_or_retreat_line": "No build-out line at 4v4. No offside.",
    "source_url": "https://www.usyouthsoccer.org/wp-content/uploads/sites/160/2023/09/Player-Development-Initiatives-2017.pdf",
    "source_title": "U.S. Soccer, Player Development Initiatives (February 2017) - Small-Sided Games Chart and 4v4 Standards of Play",
    "quote": "Size 3 ball; 4v4 (no goalkeepers); Substitutions are unlimited and can occur at any time; 4 quarters; No more than 10 minute quarters",
    "retrieved_date": "2026-10-05",
    "notes": "U.S. Soccer-authored document (copyright 2016 U.S. Soccer) hosted on US Youth Soccer's site; no copy of the PDF was found on ussoccer.com itself. The chart on p.12 lists U6/U7/U8 with 'Game Time 4x10'. Small-sided standards 'will be mandated in August 2017'; the 50% playing-time line sits in the 'Player Development Philosophy' section which the document says is 'not currently mandated'. No referee required at 4v4.",
    "additional_sources": [
      {
        "url": "https://www.ussoccer.com/stories/2017/08/five-things-to-know-how-smallsided-standards-will-change-youth-soccer",
        "title": "U.S. Soccer: Five Things to Know: How Small-Sided Standards Will Change Youth Soccer (Aug 2017)"
      }
    ]
  },
  {
    "organisation": "U.S. Soccer (Player Development Initiatives)",
    "country": "United States",
    "age_group": "U9, U10",
    "format": "7v7",
    "players_on_field": 7,
    "match_length_minutes": 50,
    "match_length_basis": "fixed",
    "periods": {
      "count": 2,
      "length_minutes": 25,
      "note": "2 halves of 25 minutes; 10 minute halftime; no added time"
    },
    "ball_size": 4,
    "goalkeeper": true,
    "heading_rule": "Deliberate heading not allowed in 7v7 games; indirect free kick to opponents from the spot of the offence (if in goal area, taken on the goal area line).",
    "substitution_rule": "Substitutions are unlimited and can occur at any stoppage.",
    "minimum_playing_time_rule": "Philosophy (best practice, not mandated): every player should play a minimum of 50% of the time in each game.",
    "build_out_or_retreat_line": "Build-out line used (equidistant between penalty area line and halfway line). Opponents must retreat behind it when the goalkeeper has the ball in hand or on a goal kick; goalkeeper punts and drop kicks not allowed (indirect free kick). Offside applies only between the build-out line and the goal line.",
    "source_url": "https://www.usyouthsoccer.org/wp-content/uploads/sites/160/2023/09/Player-Development-Initiatives-2017.pdf",
    "source_title": "U.S. Soccer, Player Development Initiatives (February 2017) - 7v7 Standards of Play",
    "quote": "7v7 (6 field players and 1 goalkeeper) ... Substitutions are unlimited and can occur at any stoppage ... 2 halves; 25 minutes halves; 10 minute halftime; No added time",
    "retrieved_date": "2026-10-05",
    "notes": "Game may not start or continue with fewer than 5 players on a team. Roster guidance: no more than 12 players (philosophy, not mandated). Field 55-65 x 35-45 yards; max goal 6.5 ft x 18.5 ft. The ussoccer.com story describes the build-out line as '14-yards in front of each goal'; the PDF says 'equidistant between the penalty area line and halfway line' - treat the yardage as approximate.",
    "additional_sources": [
      {
        "url": "https://www.ussoccer.com/stories/2017/08/five-things-to-know-how-smallsided-standards-will-change-youth-soccer",
        "title": "U.S. Soccer: Five Things to Know: How Small-Sided Standards Will Change Youth Soccer (Aug 2017)"
      }
    ]
  },
  {
    "organisation": "U.S. Soccer (Player Development Initiatives)",
    "country": "United States",
    "age_group": "U11",
    "format": "9v9",
    "players_on_field": 9,
    "match_length_minutes": 60,
    "match_length_basis": "fixed",
    "periods": {
      "count": 2,
      "length_minutes": 30,
      "note": "2 halves of 30 minutes; 10 minute halftime; no added time"
    },
    "ball_size": 4,
    "goalkeeper": true,
    "heading_rule": "Deliberate heading is not allowed in U11 games; indirect free kick to opponents from the spot of the offence.",
    "substitution_rule": "Substitutions are unlimited and can occur at any stoppage.",
    "minimum_playing_time_rule": "Philosophy (best practice, not mandated): every player should play a minimum of 50% of the time in each game.",
    "build_out_or_retreat_line": "No build-out line specified for 9v9. Offside applies (standard Law 11).",
    "source_url": "https://www.usyouthsoccer.org/wp-content/uploads/sites/160/2023/09/Player-Development-Initiatives-2017.pdf",
    "source_title": "U.S. Soccer, Player Development Initiatives (February 2017) - 9v9 Standards of Play",
    "quote": "Deliberate heading is not allowed in U11 games. Heading is currently allowed in U12 games without limitations but membership is empowered to limit or ban heading",
    "retrieved_date": "2026-10-05",
    "notes": "Chart labels columns U11 and U12 separately; both are 9v9 with identical format/duration/ball, but the heading rule differs, so they are recorded as separate rows. Game may not start or continue with fewer than 6 players. Roster guidance: no more than 16 (philosophy). Field 70-80 x 45-55 yards; max goal 7 ft x 21 ft.",
    "additional_sources": []
  },
  {
    "organisation": "U.S. Soccer (Player Development Initiatives)",
    "country": "United States",
    "age_group": "U12",
    "format": "9v9",
    "players_on_field": 9,
    "match_length_minutes": 60,
    "match_length_basis": "fixed",
    "periods": {
      "count": 2,
      "length_minutes": 30,
      "note": "2 halves of 30 minutes; 10 minute halftime; no added time"
    },
    "ball_size": 4,
    "goalkeeper": true,
    "heading_rule": "Heading allowed in U12 games without limitation under the PDI, but member organisations are empowered to limit or ban it at this level.",
    "substitution_rule": "Substitutions are unlimited and can occur at any stoppage.",
    "minimum_playing_time_rule": "Philosophy (best practice, not mandated): every player should play a minimum of 50% of the time in each game.",
    "build_out_or_retreat_line": "No build-out line specified for 9v9. Offside applies (standard Law 11).",
    "source_url": "https://www.usyouthsoccer.org/wp-content/uploads/sites/160/2023/09/Player-Development-Initiatives-2017.pdf",
    "source_title": "U.S. Soccer, Player Development Initiatives (February 2017) - 9v9 Standards of Play",
    "quote": "9v9 (8 field players and 1 goalkeeper) ... 2 halves; 30 minutes halves; 10 minute halftime; No added time",
    "retrieved_date": "2026-10-05",
    "notes": "See U11 row. Member bodies (e.g. AYSO, US Youth Soccer) apply their own heading rules at 12U/U12 - see their rows.",
    "additional_sources": []
  },
  {
    "organisation": "AYSO (American Youth Soccer Organization)",
    "country": "United States",
    "age_group": "6U",
    "format": "4v4",
    "players_on_field": 4,
    "match_length_minutes": 20,
    "match_length_basis": "maximum",
    "periods": {
      "count": 2,
      "length_minutes": 10,
      "note": "Two equal halves not to exceed 10 minutes each; half-time 5-10 minutes; no added time; playing time can be less when managed by coaches and parents"
    },
    "ball_size": 3,
    "goalkeeper": false,
    "heading_rule": "Heading banned (practices and matches) for all division players 11U and below (12U and below for programs without single-age divisions); deliberate header = indirect free kick; no cautions/send-offs for heading infractions.",
    "substitution_rule": "Substitution permitted approximately midway through each half and at half-time (the AYSO 'quarter' system); coach may substitute as many or none, including previously substituted players, as long as all eligible players meet minimum playing requirements.",
    "minimum_playing_time_rule": "Everyone Plays: all eligible team members in attendance must play at least half of the match, excluding overtime. Late arrivals: arriving in 1st quarter must play 2 of remaining 3 quarters; arriving in 2nd/3rd quarter must play at least 1 quarter. Regions may adopt the optional 'three-quarter rule' (no player plays an entire game unless all others play at least three quarters).",
    "build_out_or_retreat_line": "No build-out line at 6U. No offside. Throw-in replaced by pass-in.",
    "source_url": "https://aysovolunteers.org/wp-content/uploads/2024/04/AYSO-Reference-Book-2024-0420.pdf",
    "source_title": "AYSO Reference Book (20 April 2024) - Chapter 2 National Rules & Regulations (07/2023), Art. I.B, I.C, I.F, I.I, II.C; Chapter 8 '4V4 Standards of Play'",
    "quote": "Except as noted in Article I.C.3 all eligible team members in attendance at AYSO matches must play at least half of the match, excluding overtime.",
    "retrieved_date": "2026-10-05",